{"approved_browser_origins":[],"audit":{"blob_diagnostic_id":"/subscriptions/11111111-1111-4111-8111-111111111111/resourceGroups/rg-kmlsat-dev-application/providers/Microsoft.Storage/storageAccounts/kmlsatdevappabc123/blobServices/default/providers/Microsoft.Insights/diagnosticSettings/application-blob-audit","vault_diagnostic_id":"/subscriptions/11111111-1111-4111-8111-111111111111/resourceGroups/rg-kmlsat-dev-application/providers/Microsoft.KeyVault/vaults/akmlsatdevvabc123/providers/Microsoft.Insights/diagnosticSettings/application-key-audit","workspace_id":"/subscriptions/11111111-1111-4111-8111-111111111111/resourceGroups/rg-kmlsat-dev-application/providers/Microsoft.OperationalInsights/workspaces/law-kmlsat-dev-application"},"bootstrap_sha256":"ebde05dc2ffdcc5e24d3551fb5432d3537f5f5f04731ff118a32bc6de0b25b42","contract_scope":"persistent-data-core","cosmos":{"containers":{"catalogue":{"id":"/subscriptions/11111111-1111-4111-8111-111111111111/resourceGroups/rg-kmlsat-dev-application/providers/Microsoft.DocumentDB/databaseAccounts/cosmos-kmlsat-dev-application/sqlDatabases/treesight/containers/catalogue","name":"catalogue"},"feature_flag_overrides":{"id":"/subscriptions/11111111-1111-4111-8111-111111111111/resourceGroups/rg-kmlsat-dev-application/providers/Microsoft.DocumentDB/databaseAccounts/cosmos-kmlsat-dev-application/sqlDatabases/treesight/containers/feature_flag_overrides","name":"feature_flag_overrides"},"feature_flags":{"id":"/subscriptions/11111111-1111-4111-8111-111111111111/resourceGroups/rg-kmlsat-dev-application/providers/Microsoft.DocumentDB/databaseAccounts/cosmos-kmlsat-dev-application/sqlDatabases/treesight/containers/feature_flags","name":"feature_flags"},"monitors":{"id":"/subscriptions/11111111-1111-4111-8111-111111111111/resourceGroups/rg-kmlsat-dev-application/providers/Microsoft.DocumentDB/databaseAccounts/cosmos-kmlsat-dev-application/sqlDatabases/treesight/containers/monitors","name":"monitors"},"orgs":{"id":"/subscriptions/11111111-1111-4111-8111-111111111111/resourceGroups/rg-kmlsat-dev-application/providers/Microsoft.DocumentDB/databaseAccounts/cosmos-kmlsat-dev-application/sqlDatabases/treesight/containers/orgs","name":"orgs"},"runs":{"id":"/subscriptions/11111111-1111-4111-8111-111111111111/resourceGroups/rg-kmlsat-dev-application/providers/Microsoft.DocumentDB/databaseAccounts/cosmos-kmlsat-dev-application/sqlDatabases/treesight/containers/runs","name":"runs"},"subscriptions":{"id":"/subscriptions/11111111-1111-4111-8111-111111111111/resourceGroups/rg-kmlsat-dev-application/providers/Microsoft.DocumentDB/databaseAccounts/cosmos-kmlsat-dev-application/sqlDatabases/treesight/containers/subscriptions","name":"subscriptions"},"users":{"id":"/subscriptions/11111111-1111-4111-8111-111111111111/resourceGroups/rg-kmlsat-dev-application/providers/Microsoft.DocumentDB/databaseAccounts/cosmos-kmlsat-dev-application/sqlDatabases/treesight/containers/users","name":"users"}},"data_plane_available":false,"database":{"id":"/subscriptions/11111111-1111-4111-8111-111111111111/resourceGroups/rg-kmlsat-dev-application/providers/Microsoft.DocumentDB/databaseAccounts/cosmos-kmlsat-dev-application/sqlDatabases/treesight","name":"treesight"},"diagnostic_id":"/subscriptions/11111111-1111-4111-8111-111111111111/resourceGroups/rg-kmlsat-dev-application/providers/Microsoft.DocumentDB/databaseAccounts/cosmos-kmlsat-dev-application/providers/Microsoft.Insights/diagnosticSettings/application-cosmos-control-plane","encryption":{"client_id":"dddddddd-dddd-4ddd-8ddd-dddddddddddd","grant_sha256":"964288c4e3a21215c211cf89afdde57d93cc514d0c77ef4ad88d0f2e6fe586c9","identity_id":"/subscriptions/11111111-1111-4111-8111-111111111111/resourceGroups/rg-kmlsat-dev-application/providers/Microsoft.ManagedIdentity/userAssignedIdentities/id-kmlsat-dev-application-cosmos-encryption","key_id":"/subscriptions/11111111-1111-4111-8111-111111111111/resourceGroups/rg-kmlsat-dev-application/providers/Microsoft.KeyVault/vaults/akmlsatdevvabc123/keys/cosmos-cmk","key_uri":"https://akmlsatdevvabc123.vault.azure.net/keys/cosmos-cmk","principal_id":"eeeeeeee-eeee-4eee-8eee-eeeeeeeeeeee"},"endpoint":"https://cosmos-kmlsat-dev-application.documents.azure.com:443/","id":"/subscriptions/11111111-1111-4111-8111-111111111111/resourceGroups/rg-kmlsat-dev-application/providers/Microsoft.DocumentDB/databaseAccounts/cosmos-kmlsat-dev-application","name":"cosmos-kmlsat-dev-application"},"encryption":{"client_id":"aaaaaaaa-aaaa-4aaa-8aaa-aaaaaaaaaaaa","identity_id":"/subscriptions/11111111-1111-4111-8111-111111111111/resourceGroups/rg-kmlsat-dev-application/providers/Microsoft.ManagedIdentity/userAssignedIdentities/id-kmlsat-dev-application-encryption","key_id":"/subscriptions/11111111-1111-4111-8111-111111111111/resourceGroups/rg-kmlsat-dev-application/providers/Microsoft.KeyVault/vaults/akmlsatdevvabc123/keys/application-cmk","key_uri":"https://akmlsatdevvabc123.vault.azure.net/keys/application-cmk","principal_id":"bbbbbbbb-bbbb-4bbb-8bbb-bbbbbbbbbbbb","vault_id":"/subscriptions/11111111-1111-4111-8111-111111111111/resourceGroups/rg-kmlsat-dev-application/providers/Microsoft.KeyVault/vaults/akmlsatdevvabc123","vault_uri":"https://akmlsatdevvabc123.vault.azure.net/"},"encryption_grant_sha256":"e7db00f0a0050c78ea0e2c0f9b3746cf77b58258840a72c05f38db783353e05c","environment":"dev","namespace":{"id":"/subscriptions/11111111-1111-4111-8111-111111111111/resourceGroups/rg-kmlsat-dev-application","location":"westeurope","name":"rg-kmlsat-dev-application"},"policy_revision":"3333333333333333333333333333333333333333","producer":"foundation","producer_revision":"2222222222222222222222222222222222222222","schema_version":2,"status":"not-activated","storage":{"blob_endpoint":"https://kmlsatdevappabc123.blob.core.windows.net/","containers":{"kml_input":{"id":"/subscriptions/11111111-1111-4111-8111-111111111111/resourceGroups/rg-kmlsat-dev-application/providers/Microsoft.Storage/storageAccounts/kmlsatdevappabc123/blobServices/default/containers/kml-input","name":"kml-input"},"kml_output":{"id":"/subscriptions/11111111-1111-4111-8111-111111111111/resourceGroups/rg-kmlsat-dev-application/providers/Microsoft.Storage/storageAccounts/kmlsatdevappabc123/blobServices/default/containers/kml-output","name":"kml-output"},"pipeline_payloads":{"id":"/subscriptions/11111111-1111-4111-8111-111111111111/resourceGroups/rg-kmlsat-dev-application/providers/Microsoft.Storage/storageAccounts/kmlsatdevappabc123/blobServices/default/containers/pipeline-payloads","name":"pipeline-payloads"}},"data_plane_available":false,"id":"/subscriptions/11111111-1111-4111-8111-111111111111/resourceGroups/rg-kmlsat-dev-application/providers/Microsoft.Storage/storageAccounts/kmlsatdevappabc123","name":"kmlsatdevappabc123"},"subscription_id":"11111111-1111-4111-8111-111111111111","tenant_id":"22222222-2222-4222-8222-222222222222"}
