{"approved_browser_origins":[],"audit":{"blob_diagnostic_id":"/subscriptions/11111111-1111-4111-8111-111111111111/resourceGroups/rg-kmlsat-prd-application/providers/Microsoft.Storage/storageAccounts/kmlsatprdappabc123/blobServices/default/providers/Microsoft.Insights/diagnosticSettings/application-blob-audit","vault_diagnostic_id":"/subscriptions/11111111-1111-4111-8111-111111111111/resourceGroups/rg-kmlsat-prd-application/providers/Microsoft.KeyVault/vaults/akmlsatprdvabc123/providers/Microsoft.Insights/diagnosticSettings/application-key-audit","workspace_id":"/subscriptions/11111111-1111-4111-8111-111111111111/resourceGroups/rg-kmlsat-prd-application/providers/Microsoft.OperationalInsights/workspaces/law-kmlsat-prd-application"},"bootstrap_sha256":"d26753a61f6db30a7aea2c00d1489c227cb4abbe4f4237fec6f8b9976479a951","contract_scope":"persistent-data-core","cosmos":{"containers":{"catalogue":{"id":"/subscriptions/11111111-1111-4111-8111-111111111111/resourceGroups/rg-kmlsat-prd-application/providers/Microsoft.DocumentDB/databaseAccounts/cosmos-kmlsat-prd-application/sqlDatabases/treesight/containers/catalogue","name":"catalogue"},"feature_flag_overrides":{"id":"/subscriptions/11111111-1111-4111-8111-111111111111/resourceGroups/rg-kmlsat-prd-application/providers/Microsoft.DocumentDB/databaseAccounts/cosmos-kmlsat-prd-application/sqlDatabases/treesight/containers/feature_flag_overrides","name":"feature_flag_overrides"},"feature_flags":{"id":"/subscriptions/11111111-1111-4111-8111-111111111111/resourceGroups/rg-kmlsat-prd-application/providers/Microsoft.DocumentDB/databaseAccounts/cosmos-kmlsat-prd-application/sqlDatabases/treesight/containers/feature_flags","name":"feature_flags"},"monitors":{"id":"/subscriptions/11111111-1111-4111-8111-111111111111/resourceGroups/rg-kmlsat-prd-application/providers/Microsoft.DocumentDB/databaseAccounts/cosmos-kmlsat-prd-application/sqlDatabases/treesight/containers/monitors","name":"monitors"},"orgs":{"id":"/subscriptions/11111111-1111-4111-8111-111111111111/resourceGroups/rg-kmlsat-prd-application/providers/Microsoft.DocumentDB/databaseAccounts/cosmos-kmlsat-prd-application/sqlDatabases/treesight/containers/orgs","name":"orgs"},"runs":{"id":"/subscriptions/11111111-1111-4111-8111-111111111111/resourceGroups/rg-kmlsat-prd-application/providers/Microsoft.DocumentDB/databaseAccounts/cosmos-kmlsat-prd-application/sqlDatabases/treesight/containers/runs","name":"runs"},"subscriptions":{"id":"/subscriptions/11111111-1111-4111-8111-111111111111/resourceGroups/rg-kmlsat-prd-application/providers/Microsoft.DocumentDB/databaseAccounts/cosmos-kmlsat-prd-application/sqlDatabases/treesight/containers/subscriptions","name":"subscriptions"},"users":{"id":"/subscriptions/11111111-1111-4111-8111-111111111111/resourceGroups/rg-kmlsat-prd-application/providers/Microsoft.DocumentDB/databaseAccounts/cosmos-kmlsat-prd-application/sqlDatabases/treesight/containers/users","name":"users"}},"data_plane_available":false,"database":{"id":"/subscriptions/11111111-1111-4111-8111-111111111111/resourceGroups/rg-kmlsat-prd-application/providers/Microsoft.DocumentDB/databaseAccounts/cosmos-kmlsat-prd-application/sqlDatabases/treesight","name":"treesight"},"diagnostic_id":"/subscriptions/11111111-1111-4111-8111-111111111111/resourceGroups/rg-kmlsat-prd-application/providers/Microsoft.DocumentDB/databaseAccounts/cosmos-kmlsat-prd-application/providers/Microsoft.Insights/diagnosticSettings/application-cosmos-control-plane","encryption":{"client_id":"dddddddd-dddd-4ddd-8ddd-dddddddddddd","grant_sha256":"a6a86430a98e434711389af215421484bfd8b2e3bc0823bfb683af79d1d3fd5a","identity_id":"/subscriptions/11111111-1111-4111-8111-111111111111/resourceGroups/rg-kmlsat-prd-application/providers/Microsoft.ManagedIdentity/userAssignedIdentities/id-kmlsat-prd-application-cosmos-encryption","key_id":"/subscriptions/11111111-1111-4111-8111-111111111111/resourceGroups/rg-kmlsat-prd-application/providers/Microsoft.KeyVault/vaults/akmlsatprdvabc123/keys/cosmos-cmk","key_uri":"https://akmlsatprdvabc123.vault.azure.net/keys/cosmos-cmk","principal_id":"eeeeeeee-eeee-4eee-8eee-eeeeeeeeeeee"},"endpoint":"https://cosmos-kmlsat-prd-application.documents.azure.com:443/","id":"/subscriptions/11111111-1111-4111-8111-111111111111/resourceGroups/rg-kmlsat-prd-application/providers/Microsoft.DocumentDB/databaseAccounts/cosmos-kmlsat-prd-application","name":"cosmos-kmlsat-prd-application"},"encryption":{"client_id":"aaaaaaaa-aaaa-4aaa-8aaa-aaaaaaaaaaaa","identity_id":"/subscriptions/11111111-1111-4111-8111-111111111111/resourceGroups/rg-kmlsat-prd-application/providers/Microsoft.ManagedIdentity/userAssignedIdentities/id-kmlsat-prd-application-encryption","key_id":"/subscriptions/11111111-1111-4111-8111-111111111111/resourceGroups/rg-kmlsat-prd-application/providers/Microsoft.KeyVault/vaults/akmlsatprdvabc123/keys/application-cmk","key_uri":"https://akmlsatprdvabc123.vault.azure.net/keys/application-cmk","principal_id":"bbbbbbbb-bbbb-4bbb-8bbb-bbbbbbbbbbbb","vault_id":"/subscriptions/11111111-1111-4111-8111-111111111111/resourceGroups/rg-kmlsat-prd-application/providers/Microsoft.KeyVault/vaults/akmlsatprdvabc123","vault_uri":"https://akmlsatprdvabc123.vault.azure.net/"},"encryption_grant_sha256":"b8d09cf54a9c69f9e84613a717088e1cf487eb43fd6ddeb072f9393e130ae80a","environment":"prd","namespace":{"id":"/subscriptions/11111111-1111-4111-8111-111111111111/resourceGroups/rg-kmlsat-prd-application","location":"westeurope","name":"rg-kmlsat-prd-application"},"policy_revision":"3333333333333333333333333333333333333333","producer":"foundation","producer_revision":"2222222222222222222222222222222222222222","schema_version":2,"status":"not-activated","storage":{"blob_endpoint":"https://kmlsatprdappabc123.blob.core.windows.net/","containers":{"kml_input":{"id":"/subscriptions/11111111-1111-4111-8111-111111111111/resourceGroups/rg-kmlsat-prd-application/providers/Microsoft.Storage/storageAccounts/kmlsatprdappabc123/blobServices/default/containers/kml-input","name":"kml-input"},"kml_output":{"id":"/subscriptions/11111111-1111-4111-8111-111111111111/resourceGroups/rg-kmlsat-prd-application/providers/Microsoft.Storage/storageAccounts/kmlsatprdappabc123/blobServices/default/containers/kml-output","name":"kml-output"},"pipeline_payloads":{"id":"/subscriptions/11111111-1111-4111-8111-111111111111/resourceGroups/rg-kmlsat-prd-application/providers/Microsoft.Storage/storageAccounts/kmlsatprdappabc123/blobServices/default/containers/pipeline-payloads","name":"pipeline-payloads"}},"data_plane_available":false,"id":"/subscriptions/11111111-1111-4111-8111-111111111111/resourceGroups/rg-kmlsat-prd-application/providers/Microsoft.Storage/storageAccounts/kmlsatprdappabc123","name":"kmlsatprdappabc123"},"subscription_id":"11111111-1111-4111-8111-111111111111","tenant_id":"22222222-2222-4222-8222-222222222222"}
